{
  "id": "BKP-004",
  "title": "Registry Generator",
  "status": "In Review",
  "created_at": "2026-05-06T18:45:00Z",
  "updated_at": "2026-05-07T23:55:00Z",
  "assigned_to": "gemini-cli",
  "phase": "validation",
  "complexity": "Medium",
  "forecast": {
    "complexity": "Medium",
    "estimated_tokens": {
      "prompt": 25000,
      "reasoning": 5000,
      "output": 1500
    }
  },
  "spec_path": "docs/specs/product/004-registry-generator.md",
  "dependencies": [],
  "metadata_version": "1.0"
}
